{
  "schemaVersion": 1,
  "profiles": [],
  "profileSets": [],
  "assets": [],
  "monitorSelection": {
    "mode": "focus",
    "monitorIds": [],
    "focusSource": "foregroundWindowThenMouse"
  },
  "switches": {
    "visibilityRule": "switchA",
    "initialStateA": false,
    "initialStateB": false,
    "switchA": {
      "mode": "unbound",
      "toggleKey": null,
      "enableKey": null,
      "disableKey": null,
      "holdKey": null
    },
    "switchB": {
      "mode": "unbound",
      "toggleKey": null,
      "enableKey": null,
      "disableKey": null,
      "holdKey": null
    }
  },
  "toasts": {
    "enabled": true,
    "position": "topCenter",
    "durationMs": 1500,
    "fontFamily": "Segoe UI",
    "fontSizePx": 18,
    "foreground": "#FFFFFFFF",
    "background": "#000000B4"
  }
}
